,index,text,url,crime,location,region,city,date
11,25,"science

Updated: Jul 19, 2020 11:06 IST

The All India Institute of Medical Sciences (AIIMS) Ethics Committee on Saturday gave its approval for conducting the human clinical trial of the indigenously developed Covid-19 vaccine candidate Covaxin.

Dr Sanjay Rai, Professor at the Centre for Community Medicine at AIIMS told ANI that the hospital will start enrolling healthy individuals from Monday onwards.

“Today, we got approval from AIIMS Ethics Committee for starting the human clinical trial of the indigenously developed Covaxin. We are launching the enrollment process from Monday. We are going to select healthy participants with no comorbidities and without a history of Covid-19. The age group of the study population is 18 to 55 years. This would be a randomised, double-blind, placebo-controlled clinical trial,” Dr Rai told ANI.

The country’s top drug regulator had recently gave a green signal for human clinical trials for Covid-19 vaccine candidate Covaxin, which has been developed by the Hyderabad-based Bharat Biotech in collaboration with the ICMR and the National Institute of Virology (NIV).

Asked about the concerns raised by AIIMS Ethics Committee a few days back regarding the trial, Dr Rai said that those concerns were addressed in the Ethics Committee meeting and the panel gave green signal to initiate the trial.

“Any healthy individual who wishes to participate in the trial can send in an email on Ctaiims.Covid19@gmail.com or send an SMS or call on 7428847499,” he said, adding that in the first and second phase AIIMS (Delhi) will choose only 100 participants out of 375 volunteers and the remaining will participate at other sites.

“We have already registered a few volunteers for the trial. From Monday onwards, our team will start their health screening before giving them vaccination,” he said.

It may be noted that there are 12 places where the trial for Covaxin is taking place as per the Indian Council for Medical Research (ICMR).

Trials have started at AIIMS, Patna and few other places.

ANI had cited Director General of Indian Council of Medical Research (ICMR) Dr Balram Bhargava as saying on July 14 that as far as coronavirus pandemic is concerned the country has two indigenous candidate vaccines which scientists are trying best efforts to fast-track as their moral duty so that there should not be a delay of a single day for regulatory clearances for these vaccines to break the transmission of the virus as soon as possible.

“There are two Indian indigenous candidate vaccines and they have gone successful toxicity studies in rats, mice and rabbits. The data was submitted to the Drugs Controller General of India (DCGI) following which both these candidate vaccines got clearance to start the early phase of human trials,” he had said.

ANI had also reported that DCGI has given its permission to pharma giant Zydus Cadila besides Bharat Biotech International Limited (BBIL), which had partnered with ICMR to conduct phase I/II clinical trials on humans for Covid -19 vaccine.",https://www.hindustantimes.com/science/aiims-to-start-clinical-trial-of-indigenous-vaccine-covaxin-from-monday/story-ccyhna8LNjldKxXE44snHL.html,Covid,/Updated:Ghaziabad,Updated,Ghaziabad,2020-07-19 11:06:38+05:30
12,26,"india

Updated: Jul 19, 2020 11:32 IST

Congress leader Rahul Gandhi on Sunday sharpened his attack on the Bharatiya Janata Party (BJP) with a three-pronged criticism of the government on a number of issues he has been raising already.

Hours before, Rahul Gandhi had tweeted his criticism of the Centre over its handling of the face-off with China in eastern Ladakh last month, saying India will pay a “huge price because of the government’s cowardly actions”.

On Sunday, the former Congress president added the coronavirus pandemic, India’s economy and the border stand-off with China to his list yet again.

“BJP has institutionalised lies. 1. Covid19 by restricting testing and misreporting deaths. 2. GDP by using a new calculation method. 3. Chinese aggression by frightening the media,” Gandhi posted.

He also repeated his warning from Saturday.

“The illusion will break soon and India will pay the price,” he said.

The Wayanad lawmaker and his party have been raising these issues relentlessly and calling out the government over what they have said is the mishandling of the situations facing the country.

Gandhi had issued a video on Twitter to talk about several aspects of the government’s policies that he said the Centre has destroyed over the last six years and resulted in the present action by the Chinese.

“Since 2014, the PM’s constant blunders and indiscretions have fundamentally weakened India and left us vulnerable. Empty words don’t suffice in the world of geopolitics,” Gandhi tweeted on Friday.

That day he gave three reasons behind China’s aggressive stance against India as both the neighbours have clashed on its border in eastern Ladakh in the last few months taking their ties to a new low.",https://www.hindustantimes.com/india-news/after-chamberlain-comparison-rahul-gandhi-attacks-bjp-over-institutionalised-lies/story-3tTr9qqpkwrimNGSBLlX7I.html,Covid,/Updated:Ghaziabad,Updated,Ghaziabad,2020-07-19 11:01:33+05:30
13,28,"bollywood

Updated: Jul 19, 2020 10:43 IST

Sushant Singh Rajput’s sister Shweta Singh Kirti has paid a heartfelt tribute to her late brother with a special video that gives a glimpse into his personal life. It comprises of his candid moments captured by his family members with Don McLean’s song Starry, Starry Night from the album American Pie playing in the background.

Shweta wrote along with the video on Instagram, “My Forever Star. A pain so precious so close tat u wldnt trade the world for it!! A wound so deep, so grave you wouldn’t and couldn’t ever share it!” The video has a quote in the beginning, “Somewhere between neurons and narratives I was born, lived (dreamt) and die - Sushant Singh Rajput”.

It opens with Sushant playing a guitar in a room and then on a terrace. He is also seen sketching, doing calligraphy, playing with his dog, looking at the stars from his balcony and even giving lessons in a tuition class. There are also glimpses of him aiming with a rifle (probably during the prep for the film Sonchiriya) and flinging a bat (probably during a practice session for his film MS Dhoni The Untold Story). He is also seen reading in a quiet corner and replying to fan messages on his tablet. One shot also shows him sitting on the pilot’s seat in a small plane, while another shows him looking for stars in the night sky through his telescope. It ends with a funny video of Sushant watching Govinda and Karisma Kapoor’s song Sona Kitna Sona Hai and getting up to dance to the song alongside his dog.

Also read: Priyanka Chopra sits in Nick Jonas’ lap to stare in his eyes, he says ‘I am so grateful we found one another’. See pic

Sushant died by suicide on June 14. He was suffering from depression. His untimely death has led to a massive uproar over the prevalence of nepotism and favouritism in the film industry. Without specifying for whom it was meant for, Shweta had written a cryptic tweet on Instagram on Saturday. She wrote, “Help if you can; if you cannot, fold your hands and stand by and see things go on. Do not injure, if you cannot render help. -- Swami Vivekananda.”

If you need support or know someone who does, please reach out to your nearest mental health specialist. Helplines: Aasra: 022 2754 6669; Sneha India Foundation: +914424640050 and Sanjivini: 011-24311918

Follow @htshowbiz for more",https://www.hindustantimes.com/bollywood/sushant-singh-rajput-s-sister-shares-a-glimpse-into-his-personal-life-says-a-pain-so-precious-so-close-watch/story-tM1vlFakSTJudKcrCox3zM.html,Riot,/Updated:Ghaziabad,Updated,Ghaziabad,2020-07-19 10:38:21+05:30
14,30,"Priyanka Chopra sits in Nick Jonas’ lap to stare in his eyes, he says ‘I am so grateful we found one another’. See pic

bollywood

Updated: Jul 19, 2020 07:57 IST

Priyanka Chopra celebrated her 38th birthday on Saturday and was showered with love from fans, friends and colleagues from across the world. Husband Nick Jonas also shared a heartfelt birthday wish for the former Miss World along with a romantic picture on Instagram.

Sharing a picture which shows Priyanka sitting in his lap as the two stare into each other’s eyes, Nick wrote, “I could stare into your eyes forever. I love you baby. You are the most thoughtful, caring and wonderful person I have ever met. I am so grateful we found one another. Happy birthday beautiful.”

Priyanka’s father-in-law Kevin Jonas had also wished the actor with a sweet post. Sharing a family picture from Priyanka and Nick’s engagement ceremony, he wrote, “Happy Birthday @priyankachopra. You bring joy to our family. Love you!” It shows Nick’s parents and Priyanka’s brother and mother along with the couple.

Priyanka’s elder brother-in-law Kevin Jonas and his wife Danielle Jonas also shared birthday wishes for her on their respective Instagram stories.

Her other family members also took to social media to make the actor’s day special with warm birthday wishes. Brother Siddharth Chopra shared several unseen pictures from their family album on the occasion and wrote, “Happy birthday to a sister, a friend, a guardian. Through thick n thin always. Fighting, competing, making up but still always together. Wish you lots of love and a very happy birthday didi. Miss you loads.”

Also read: Priyanka Chopra gets birthday love from Kareena Kapoor, Farhan Akhtar and Anushka Sharma. See pics

Priyanka was recently announced the ambassador of the Toronto International Film Festival (TIFF) 2020. She has joined the list of 50 celebrated filmmakers and actors who are invited as the ambassadors of the TIFF.

On the work front, the Barfi actor has signed a two-year multimillion-dollar first-look television deal with Amazon, reported Variety. As per the publication, a general meeting with Amazon Studios head Jennifer Salke was what led to the first-look deal.

The actor has many projects in her kitty including The White Tiger with Rajkummar Rao. She also has a reality series based on the pre-wedding ceremony Sangeet; Russo brothers’s Citadel and Sheela, a biopic of the controversial aide to Osho, Maa Anand Sheela.

Follow @htshowbiz for more",https://www.hindustantimes.com/bollywood/priyanka-chopra-sits-in-nick-jonas-lap-to-stare-in-his-eyes-he-says-i-am-so-grateful-we-found-one-another-see-pic/story-KPOobwyzWlVWXFjfDeSBdI.html,Riot,/Updated:Ghaziabad,Updated,Ghaziabad,2020-07-19 07:56:45+05:30
15,32,"india

Updated: Jul 19, 2020 11:32 IST

Congress leader Rahul Gandhi on Sunday sharpened his attack on the Bharatiya Janata Party (BJP) with a three-pronged criticism of the government on a number of issues he has been raising already.

Hours before, Rahul Gandhi had tweeted his criticism of the Centre over its handling of the face-off with China in eastern Ladakh last month, saying India will pay a “huge price because of the government’s cowardly actions”.

On Sunday, the former Congress president added the coronavirus pandemic, India’s economy and the border stand-off with China to his list yet again.

“BJP has institutionalised lies. 1. Covid19 by restricting testing and misreporting deaths. 2. GDP by using a new calculation method. 3. Chinese aggression by frightening the media,” Gandhi posted.

He also repeated his warning from Saturday.

“The illusion will break soon and India will pay the price,” he said.

The Wayanad lawmaker and his party have been raising these issues relentlessly and calling out the government over what they have said is the mishandling of the situations facing the country.

Gandhi had issued a video on Twitter to talk about several aspects of the government’s policies that he said the Centre has destroyed over the last six years and resulted in the present action by the Chinese.

“Since 2014, the PM’s constant blunders and indiscretions have fundamentally weakened India and left us vulnerable. Empty words don’t suffice in the world of geopolitics,” Gandhi tweeted on Friday.

That day he gave three reasons behind China’s aggressive stance against India as both the neighbours have clashed on its border in eastern Ladakh in the last few months taking their ties to a new low.",https://www.hindustantimes.com/india-news/after-chamberlain-comparison-rahul-gandhi-attacks-bjp-over-institutionalised-lies/story-3tTr9qqpkwrimNGSBLlX7I.html,Covid,/Updated:Ghaziabad,Updated,Ghaziabad,2020-07-19 11:01:33+05:30
16,33,"India reports record 38,902 new Covid-19 cases in one day, tally over 10.77 lakh

india

Updated: Jul 19, 2020 11:02 IST

India recorded 38,902 new cases of the coronavirus disease (Covid-19), the highest in 24 hours, and 543 deaths, which has pushed the country’s tally to 1,077,618, Union health ministry data showed on Sunday.

The number of recovered people continued to grow and with 23,672 discharged between Saturday and Sunday morning, 677,422 patients have been cured so far across the country. This has put the recovery rate at 62.82%.

There are 373,379 actives cases of Covid-19 and 26,816 people have succumbed to the viral disease till date, data showed.

Also read: Community spread of Covid-19: IMA sounds alarm, ICMR ramps up testing, states keep tight vigil

The government has said India’s focus is on early case detection and saving lives.

It pointed out that the 11 most Covid-19 affected countries in the world—the US, Brazil, Russia, Peru, Chile, Mexico, South Africa, the UK, Iran, Pakistan, Spain—together reported eight times more cases and 14 times more deaths than India.

India is only the third country after the United States and Brazil with more than a million cases.

The number of Covid-19 cases in Maharashtra climbed to 300,937, more than 130 days after the first infection was reported in the state. There have been 11,596 fatalities in the state. The latest 100,000 cases in Maharashtra came in 14 days. The state’s first 100,000 infections were reported in 96 days, while the next 100,000 cases took 22 days.

Tamil Nadu reported 165,714 Covid-19 infections and 2,403 deaths, while Delhi has 121,582 cases and 3,597 fatalities.

The viral disease has now infected 14,246,121 people and killed 601,549 people in almost seven months across the world.

The first case was reported in China in early January and it took three months to reach one million cases. It has taken just four days to climb to 14 million cases from the 13 million recorded on July 13.

Also read: How soon can the world get Covid-19 vaccine? A look at which country stands where

The first death was reported on January 10 in Wuhan, China, before infections and fatalities then surged in Europe and later in the US.

Global coronavirus infections passed 14 million on Friday, marking the first time a surge of one million cases in just under 100 hours, while the fatalities from the viral illness exceeded 600,000 just hours later.",https://www.hindustantimes.com/india-news/india-reports-record-38-902-new-covid-19-cases-in-one-day-tally-over-10-77-lakh/story-CH8Ihf97zxe1gPU102C6IL.html,Covid,/Updated:Ghaziabad,Updated,Ghaziabad,2020-07-19 10:12:18+05:30
17,35,"india

Updated: Jul 19, 2020 11:17 IST

The spike in the number of Covid-19 cases in India has resulted in the community spread of the coronavirus disease, according to the Indian Medical Association (IMA). It also said that the situation is pretty bad in the country.

The number of Covid-19 positive cases has crossed a million mark, making India the third country after United States and Brazil to reach this grim milestone.

“This is now an exponential growth. Every day the number of cases is increasing by more than around 30,000. This is really a bad situation for the country,” Dr VK Monga, the Chairman of IMA Hospital Board of India, told news agency ANI.

WHO reports record daily increase in global Covid-19 cases for second day in a row

He further said that the disease is sreading to the rural areas. “This is a bad sign. It now shows a community spread,” said Dr Monga.

The first to sound this alarm was Kerala chief minister Pinarayi Vijayan who had said on Friday that there is a community spread in some places in coastal areas of Thiruvananthapuram district.

The two hamlets identified by Vijayan are Poonthura and Pulluvila, which have seen a rapid increase in the number of contact cases.

The district’s coastal area, stretching from Edava in the north to Pozhiyoor in the south, has been declared as Critical Containment Zone (CCZ) and will be under complete and strict lockdown from Saturday midnight to July 28 midnight, an order from the district Collector Dr Navjot Khosa said.

Texas coronavirus cases include more than 80 infants

Dr Monga said the cases are penetrating down into towns and villages where it will be very difficult to control the situation. “In Delhi, we were able to contain it, but what about interior parts of the country in Maharashtra, Karnataka, Kerala, Goa, Madhya Pradesh?”

There are concerns in states like Andhra Pradesh, Assam, Bihar, Gujarat, Karnataka, Telangana, Uttar Pradesh, and West Bengal but the respective state governments have maintained that community spread has not started.

The Indian Council of Medical Research (ICMR), meanwhile, said that it is ramping up testing facilities regularly. At present, 885 government laboratories and 368 private laboratory chains are conducting Covid-19 tests across the country.

As many as 1,34,33,742 samples have been tested for Covid-19 till July 17. Of these 3,61,024 samples were tested on Friday, the ICMR said.

It took India 137 days to reach the million mark (since March 2) in terms of the number of Covid-19 cases, but each quarter of that million has come at a faster pace.

The first 2.5 lakh cases took 98 days. The next quarter of a million cases took less than three weeks (19 days). By July 8, when India was 2.5 lakh cases short of hitting the million mark and it took just eight days for the country to record the last quarter of that million.",https://www.hindustantimes.com/india-news/community-spread-of-covid-19-ima-sounds-alarm-icmr-ramps-up-testing-states-keep-tight-vigil/story-82dWsmHJY1ivYTfrigRNyK.html,Riot,/Updated:Ghaziabad,Updated,Ghaziabad,2020-07-19 08:44:27+05:30
18,37,"How soon can the world get Covid-19 vaccine? A look at which country stands where

world

Updated: Jul 19, 2020 10:48 IST

The number of coronavirus cases in the world has crossed the 14 million-mark and more than six lakh people have died. The entire world is racing to find a vaccine to check the spread of the coronavirus disease.

Many countries like the US, Russia, China and the UK, along with India, are trying to find a vaccine for Covid-19.

More than 130 vaccines are under various stages of testing across the world. Here is a look at the efforts being made by different countries in a bid to find Covid-19 vaccine:

Russia

The researchers in Russia have claimed that they will launch the first Covid-19 vaccine in August. The Moscow State Medical University has claimed that it has successfully completed clinical trials for the vaccine. The trials started on June 18; the first batch of the volunteers were discharged on July 15 while the second one will be released by July 20.

Also read: Russia is trying to beat the west to a Covid-19 vaccine

China

The human trials being conducted by Chinese company Sinovac Biotech have reached the third stage. This is the first vaccine to reach the third stage of human trials. The first dose was given to 15,000 registered volunteers in Abu Dhabi. They were administered the vaccine twice within 28 days and the researchers saw development of anti-bodies in them. There are four vaccines being developed in China for Covid-19.

The UK

The vaccine being developed by Oxford University and Imperial College are in second and third stage of human trials. In the second stage, 105 people are expected to be administered the vaccine. The stage 3 trial is expected to begin in November and will cover 6,000 people.

India

Covaxin and ZyCov-D, the two medicines being developed in India, are in the first and second stage of trials. While Covaxin has been developed by Bharat Biotech, a pharmaceutical company based in Hyderabad, Zydus has come up with ZyCov-D. There have been no side effects on the volunteers who have been administered the vaccine. At least 100 million doses will be prepared after the successful completion of these trials, which are expected to be over by March.

Also read| First phase trial of Covaxin, India’s Covid-19 vaccine, starts on 375 people: Report

United States

Biotechn company Moderna is preparing to conduct final stage of human trial by July 27. It will conduct these trials at 87 places, all in the US. The US government will fund the development of this vaccine.

Germany, Australia

While German companies have reached the second stage of vaccine development for Covid-19, Suatralian companies are still on the first stage.",https://www.hindustantimes.com/world-news/how-soon-can-the-world-get-covid-19-vaccine-a-look-at-which-country-stands-where/story-kweR8xCNlXwyvhFp4Bdy6I.html,Covid,/Updated:Ghaziabad,Updated,Ghaziabad,2020-07-19 08:00:53+05:30
