date,username,to,replies,retweets,favorites,text,geo,mentions,hashtags,id,permalink
2020-07-26 04:44:08,ANI,,28,256,1760,"Kargil is not only a symbol of our self-respect but also a step taken against injustice. Former PM AB Vajpayee had said that within the purview of national security whatever we do is for self-defence and not attack... :Defence Minister Rajnath Singh #KargilVijayDiwaspic.twitter.com/GrWbMPnNFs",,,#KargilVijayDiwaspic,1287247306304024576,https://twitter.com/ANI/status/1287247306304024576
2020-07-25 03:38:08,ANI,,28,338,1973,"Why did Cong take 16yrs to appreciate his contributions? Sonia Gandhi&R.Gandhi never attended events held to mark his birth/death anniversary:NV Subhash,grandson of ex-PM PV Narasimha Rao&Telengana BJP leader on T'gana Cong organising events on birth centenary of PV Narasimha Raopic.twitter.com/kilBc6uU5u",,,,1286868310852657152,https://twitter.com/ANI/status/1286868310852657152
2020-07-24 07:28:20,ANI,,178,816,6420,"Indian Premier League (IPL) 2020 to be played from 19th September to 8th November. It will be a full-fledged tournament: Brijesh Patel, IPL Chairmanpic.twitter.com/QsULr9EqtZ",,,,1286563853363376128,https://twitter.com/ANI/status/1286563853363376128
2020-07-24 07:05:34,ANI,,145,332,1972,"Delhi: Toxic foam seen in river Yamuna at Okhla Barrage.pic.twitter.com/bGCJY1FMe0",,,,1286558125764444160,https://twitter.com/ANI/status/1286558125764444160
2020-07-23 21:07:35,ANI,,28,512,2793,"China ripped off our prized intellectual property and trade secrets. It sucked supply chains away from America and then added a widget made of slave labour. It made the world’s key waterways less safe for international commerce: Mike Pompeo, US Secretary of Statepic.twitter.com/oKhOIzGNuO",,,,1286407636703801345,https://twitter.com/ANI/status/1286407636703801345
2020-07-23 19:46:14,ANI,,478,260,2697,"Maharashtra: Haji Goat Farm in Jogeshwari, Mumbai is selling goats online this #EidAlAdha in view of COVID19. Wasim Khan, owner of the farm says, ""Customers can view pictures of goats online & choose which one they want. We deliver directly to their homes to avoid crowding.""pic.twitter.com/dX5QCTC3dq",,,#EidAlAdha,1286387164599656448,https://twitter.com/ANI/status/1286387164599656448
2020-07-23 15:03:05,ANI,,528,369,1630,"Maharashtra govt has decided to distribute Rs 1.80 Crores among the teachers of 121 madrasas in the state, for their salaries under Dr Zakir Hussain Madarsa Modernisation Scheme: Maharashtra’s Minority Development Minister Nawab Malik (file pic)pic.twitter.com/CnZp24lFAj",,,,1286315906629398529,https://twitter.com/ANI/status/1286315906629398529
2020-07-23 08:59:10,ANI,,302,372,3592,"We don't want any position or to be a trustee of the Ram Temple. We only want that the temple should be built properly and the foundation stone should be laid at the right time, but this is an 'ashubh ghadi' (inauspicious time): Shankaracharya Swaroopanand Saraswatipic.twitter.com/9gwLl1ZzUP",,,,1286224323385028608,https://twitter.com/ANI/status/1286224323385028608
2020-07-22 23:39:10,ANI,,301,1013,3977,"Haryana: Rajkumar, a tea seller in Kurukshetra claims he owes Rs50 crores to banks without even taking a loan. Says, ""I had applied for a loan as my financial situation is dire due to COVID. Bank rejected it saying I already have debt of Rs 50 cr, don't know how it is possible.""pic.twitter.com/BhTStsIwiy",,,,1286083395294908416,https://twitter.com/ANI/status/1286083395294908416
2020-07-22 18:14:46,ANI,,333,2407,24415,"Russian President Vladimir Putin expressed his deepest condolences to President of India Ram Nath Kovind and Prime Minister of India Narendra Modi over the tragic consequences of the floods in several states of the country: Office of Russia's President (file pic)pic.twitter.com/b3ScY2IzJa",,,,1286001758183940096,https://twitter.com/ANI/status/1286001758183940096
2020-07-22 14:27:05,ANI,ANI,101,2871,10411,"India has a chance to check global supply chain away from China & reduce reliance on Chinese companies in areas like telecom, medical supplies & others. India is in this position because it has earned the trust of many nations including US: Mike Pompeo, US Secretary of Statehttps://twitter.com/ANI/status/1285944181299372033 …",,,,1285944460115771393,https://twitter.com/ANI/status/1285944460115771393
2020-07-22 13:50:43,ANI,,52,1840,13093,"We have invited PM Modi to the next G7 Summit, where we will advance the international prosperity network: Mike Pompeo, US Secretary of State at India Ideas Summitpic.twitter.com/HquSZKMWeK",,,,1285935305606836224,https://twitter.com/ANI/status/1285935305606836224
2020-07-22 09:15:40,ANI,,130,1029,7468,"PM Narendra Modi will lay the foundation stone of Ram Temple on August 5. To ensure social distancing at the programme, we've decided that there will not be more than 200 people including 150 invitees: Swami Govind Dev Giri, Treasurer of Shri Ram Janmabhoomi Tirtha Kshetrapic.twitter.com/NBO7zaGMvG",,,,1285866088689922050,https://twitter.com/ANI/status/1285866088689922050
2020-07-21 22:28:28,ANI,,47,388,1017,"Delhi: National Students' Union of India (NSUI) workers protested in front of MHRD office yesterday against the University Grants Commission's decision to conduct final year examinations.pic.twitter.com/VxwSSz2FD8",,,,1285703213858127875,https://twitter.com/ANI/status/1285703213858127875
2020-07-21 08:08:10,ANI,,325,873,2987,"Karnataka: A cow succumbed to injuries after it accidentally ate explosive material which was allegedly kept to kill wild pigs at a farm near HD Kote in Mysuru.pic.twitter.com/ibqaCCoT1Y",,,,1285486714488713216,https://twitter.com/ANI/status/1285486714488713216
2020-07-21 06:13:50,ANI,,231,954,4998,"Two students who appeared for Kerala Engineering Architecture Medical (KEAM) examination at two different exam centres in Thiruvananthapuram have tested positive for #COVID19.",,,#COVID19,1285457941437444096,https://twitter.com/ANI/status/1285457941437444096
2020-07-21 04:31:05,ANI,,1730,1123,4958,"#WATCH Workers of Swabhimani Shetkari Sangathna spill milk on the streets of Sangli as a mark of protest. The organisation is demanding Rs 25 per litre as the minimum rate of cow milk, among others. #Maharashtrapic.twitter.com/0GSq9fb1aT",,,#WATCH #Maharashtrapic,1285432083209351169,https://twitter.com/ANI/status/1285432083209351169
2020-07-20 01:38:21,ANI,,584,4901,34848,"#WATCH 'Bhasma aarti' performed in the early morning hours at Ujjain's Mahakaleshwar temple on the third Monday of 'sawan' month, today. #MadhyaPradeshpic.twitter.com/5Fs58qVth1",,,#WATCH #MadhyaPradeshpic,1285026227112165376,https://twitter.com/ANI/status/1285026227112165376
2020-07-19 20:46:26,ANI,,149,1685,10982,"Odisha: A yellow turtle was rescued by locals from Sujanpur village in Balasore district. It was later handed over to Forest Department officials. B Acharya, Wildlife Warden says, ""This is a rare turtle, I have never seen one like this."" (19.07.20)pic.twitter.com/MWxjLzabyc",,,,1284952760492765184,https://twitter.com/ANI/status/1284952760492765184
2020-07-25 20:46:25,ANI,,26,347,2521,"Part 1 of phase-1 of vaccine trial (Covaxin) completed. 50 people across India were administered the vaccine, results encouraging. 6 people were administered vaccine today under part 2 of phase-1: Dr Savita Verma, Principal Investigator of vaccine trial team at PGI Rohtak (25.07)pic.twitter.com/TsZhOoZr2S",,,,1287127086742691840,https://twitter.com/ANI/status/1287127086742691840
2020-07-25 15:40:23,ANI,,37,350,2927,"United States' policy is crystal clear. South China Sea is not China’s maritime empire. If Beijing violates international law & free nations do nothing, history shows CCP will simply take more territory. China Sea disputes must be resolved through int'l law: US Secretary of Statepic.twitter.com/kqCaE5RuFv",,,,1287050068315578368,https://twitter.com/ANI/status/1287050068315578368
2020-07-24 17:56:35,ANI,,42,156,1405,"Government of India has extended medical assistance worth about US$1 million to Democratic People’s Republic of Korea (DPRK) in response to a request received from the World Health Organisation (WHO): Ministry of External Affairs (MEA)pic.twitter.com/MppcjN1ahK",,,,1286721956193026049,https://twitter.com/ANI/status/1286721956193026049
2020-07-24 10:44:53,ANI,,306,4779,27225,"#WATCH 85-year-old Shantabai Pawar performs 'Lathi Kathi' on streets of Pune to earn a livelihood. She says, ""I'm doing it since I was 8. My father taught me to work hard. People mostly remain indoors due to #COVID, so I clang utensil to alert them when I perform."" #Maharashtrapic.twitter.com/NCI7kcbKxT",,,#WATCH #COVID #Maharashtrapic,1286613316723335169,https://twitter.com/ANI/status/1286613316723335169
2020-07-24 07:10:42,ANI,,117,417,1599,"#WATCH Delhi: Toxic foam seen in river Yamuna at Okhla Barrage.pic.twitter.com/JinH1WCtti",,,#WATCH,1286559414804049920,https://twitter.com/ANI/status/1286559414804049920
2020-07-23 10:42:37,ANI,,105,515,5127,"Madhya Pradesh: Congress MLA from Mandhata, Narayan Patel resigns from his membership of the Legislative Assembly.",,,,1286250358931517440,https://twitter.com/ANI/status/1286250358931517440
2020-07-23 08:04:35,ANI,,73,545,3869,"Supreme Court says it will hear in the next two days a plea of 31 students challenging the latest University Grants Commission (UGC) circular on conducting of the final year examinations. The plea also seeks cancellations of the examinations.",,,,1286210588050251776,https://twitter.com/ANI/status/1286210588050251776
2020-07-23 06:33:30,ANI,,16,419,1874,"J&K: West Pakistani refugees in Jammu's Arnia are getting domicile certificates. Labaram Gandhi, President, West Pakistan Refugee Action Committee says,""We're happy. Without these, our children weren't able to get jobs. Due to abrogation of Article 35A, we're getting our rights.""pic.twitter.com/vZpKp4eVvs",,,,1286187667193921538,https://twitter.com/ANI/status/1286187667193921538
2020-07-22 14:25:59,ANI,,22,808,3100,"Important that democracies like ours work together at a time when we see true scope of challenge posed by Chinese Communist Party. Recent clashes initiated by PLA are examples of CCP's unacceptable behaviour. Deeply saddened by deaths of 20 Indian servicemembers: US Secy of Statepic.twitter.com/CX6fVLon6w",,,,1285944181299372033,https://twitter.com/ANI/status/1285944181299372033
2020-07-22 11:04:03,ANI,,93,186,1001,"Delhi: Part of Mahipalpur Bypass caved in following heavy rainfall in the national capital region today.pic.twitter.com/Z79oLBRs0y",,,,1285893364953407489,https://twitter.com/ANI/status/1285893364953407489
2020-07-20 22:35:46,ANI,,77,97,594,"Jammu & Kashmir: Lakes & Waterways Development Authority (LAWDA) has started dredging of Dal Lake's Teilbal settling basin. Tufail Matto, LAWDA Vice Chairman says, ""This settling basin hasn't been desilted for around 20 yrs. This process will take about a year to complete""(20.07)pic.twitter.com/ZttIVyx62n",,,,1285342666180276225,https://twitter.com/ANI/status/1285342666180276225
2020-07-20 14:35:32,ANI,,44,339,805,"Director General of Health Services, Ministry of Health has written to all states and UTs stating, ""the use of valved respirator N-95 masks is detrimental to the measures adopted for preventing spread of Coronavirus as it doesn't prevent the virus from escaping out of the mask.""pic.twitter.com/TEA8BAqxzz",,,,1285221808627572737,https://twitter.com/ANI/status/1285221808627572737
2020-07-20 04:10:22,ANI,,116,474,1676,"India's #COVID19 case tally crosses 11 lakh mark with highest single day spike of 40,425 new cases & 681 deaths reported in the last 24 hours. Total cases stand at 11,18,043 including 3,90,459 active cases, 7,00,087 cured/discharged/migrated & 27,497 deaths: Health Ministrypic.twitter.com/Zf5TOgWYuS",,,#COVID19,1285064483132411905,https://twitter.com/ANI/status/1285064483132411905
2020-07-19 20:11:45,ANI,,19,173,1155,"US: Members of the Indian-American community protest against China outside the Chinese Embassy in Washington DC.pic.twitter.com/oxLEipZN6R",,,,1284944034813710337,https://twitter.com/ANI/status/1284944034813710337
2020-07-19 17:16:33,ANI,,589,403,3826,"Rajasthan: Congress MLAs supporting Chief Minister Ashok Gehlot watch ‘Sholay’ at Hotel Fairmont in Jaipur.pic.twitter.com/ADag7RE4LB",,,,1284899945556803585,https://twitter.com/ANI/status/1284899945556803585
2020-07-19 14:32:28,ANI,,163,378,1682,"One Indian injured after Nepal Police shot at three Indian men near India-Nepal border in Kishanganj. Injured shifted to hospital. Investigation underway: SP Kishanganj, Biharpic.twitter.com/0eGnJyo1gd",,,,1284858650146729984,https://twitter.com/ANI/status/1284858650146729984
2020-07-19 04:03:33,ANI,,139,670,2477,"Highest single day spike of 38,902 cases and 543 deaths reported in India in the last 24 hours. Total #COVID19 positive cases stand at 10,77,618 including 3,73,379 active cases, 6,77,423 cured/discharged/migrated and 26,816 deaths: Ministry of Health and Family Welfarepic.twitter.com/u8im5qLQcI",,,#COVID19,1284700380719230977,https://twitter.com/ANI/status/1284700380719230977
2020-07-19 03:26:50,ANI,,28,475,3327,"At about 2:45 am boat naka party at Nangli Ghat observed some suspected items floating in Ravi river from Pakistan side to Indian side. Troops managed to seize suspected items&drag them to river bank. 60 packets of suspected narcotics/heroin, tied with a rope, found: BSF. #Punjabpic.twitter.com/l8m0E3I0H9",,,#Punjabpic,1284691139275001856,https://twitter.com/ANI/status/1284691139275001856
2020-07-18 08:53:21,ANI,,153,1714,12991,"#WATCH Defence Minister Rajnath Singh among troops during his visit to a forward post near LoC in Kupwara district, J&K, earlier today.pic.twitter.com/d2ggx21nLw",,,#WATCH,1284410919905189893,https://twitter.com/ANI/status/1284410919905189893
2020-07-17 16:31:09,ANI,,148,417,4036,"Mumbai: Actor Aishwarya Rai Bachchan admitted at Nanavati Hospital. Earlier, she was home quarantined after she tested positive for #COVID19. (File pic)pic.twitter.com/KIhw7OsgHc",,,#COVID19,1284163741584461826,https://twitter.com/ANI/status/1284163741584461826
2020-07-25 16:29:23,ANI,,116,126,2016,"Prime Minister Narendra Modi to address the nation through his radio programme 'Mann Ki Baat' at 11 AM tomorrow. (file pic)pic.twitter.com/kuqCiUMNpv",,,,1287062400500248576,https://twitter.com/ANI/status/1287062400500248576
2020-07-25 12:06:58,ANI,,23,304,1975,"Delhi: An NGO has extended support to women refugees from Pakistan living in Majnu-ka-Tila, so that they can earn by making rakhis. One of them, Rani says,""We're making rakhis for our brothers who're fighting for us at borders. We want to thank them, our blessings are with them.""pic.twitter.com/FCE1L9ep0F",,,,1286996361464832000,https://twitter.com/ANI/status/1286996361464832000
2020-07-25 07:33:48,ANI,,234,1007,7871,"Jammu and Kashmir: Ishfaq Rashid Khan, one of the top LeT commanders and LeT terrorist Aijaz Ahmad were neutralised by security forces today during Ranbirgarh encounterpic.twitter.com/hDlrptbNy4",,,,1286927618764406784,https://twitter.com/ANI/status/1286927618764406784
2020-07-24 16:40:04,ANI,,9,190,2447,"Reserve Bank of India (RBI) signs document for US dollar 400 million currency swap facility to Sri Lanka till November 2022: High Commission of India in Colombo, Sri Lanka",,,,1286702700961263616,https://twitter.com/ANI/status/1286702700961263616
2020-07-24 16:03:00,ANI,,69,574,3157,"Rajasthan’s Governor Kalraj Mishra writes to CM Ashok Gehlot stating, 'Before I could discuss the matter with experts regarding Assembly session, you have publically said that if Raj Bhawan is 'gheraoed' then it is not your responsibility. (file pic) (1/2)pic.twitter.com/Q2nqFcWDuB",,,,1286693371885412352,https://twitter.com/ANI/status/1286693371885412352
2020-07-24 15:51:45,ANI,,48,296,2108,"Manner in which Ashok Gehlot is working in Rajasthan with politicised bureaucracy, corruption & vendetta was exposed by media today. It was exposed that the wife & family of the then SOG head Anil Paliwal has business connections with the family of Ashok Gehlot: Sambit Patra, BJPpic.twitter.com/X5temFxNMQ",,,,1286690540298227712,https://twitter.com/ANI/status/1286690540298227712
2020-07-24 06:31:03,ANI,,77,261,3270,"Bharatiya Janata Party (BJP) writes to state chiefs and in-charges to organise events on completion of one year of abrogation of Article 370 and passing of Triple Talaq Bill.pic.twitter.com/MuaWtLJrpo",,,,1286549438362574848,https://twitter.com/ANI/status/1286549438362574848
2020-07-24 04:00:44,ANI,,127,543,2363,"Highest single-day spike of 49,310 cases and 740 deaths reported in India in the last 24 hours. Total #COVID19 positive cases stand at 12,87,945 including 4,40,135 active cases, 8,17,209 cured/discharged/migrated & 30,601 deaths: Health Ministrypic.twitter.com/veE2V1JgH9",,,#COVID19,1286511607095336961,https://twitter.com/ANI/status/1286511607095336961
2020-07-23 21:33:30,ANI,,12,290,1578,"If we do not act now, ultimately, the Chinese Communist Party (CCP) will erode our freedoms and subvert the rules-based order that our societies have worked so hard to build: Mike Pompeo, US Secretary of Statepic.twitter.com/PdPEbXE4Eu",,,,1286414157542113280,https://twitter.com/ANI/status/1286414157542113280
2020-07-23 04:04:41,ANI,,155,642,2315,"India's #COVID19 case tally crosses 12 lakh mark with highest single-day spike of 45,720 new cases & 1,129 deaths in the last 24 hrs Total #COVID19 positive cases stand at 12,38,635 incl 4,26,167 active cases, 7,82,606 cured/discharged/migrated & 29,861deaths: Health Ministrypic.twitter.com/PsNwAozRT0",,,#COVID19 #COVID19,1286150216001785859,https://twitter.com/ANI/status/1286150216001785859
2020-07-22 14:55:52,ANI,,5,49,391,"Today NIA arrested accused Sunil Manjhi, resident of Giridih, Jharkhand in a case of seizure of Rs 6 Lakhs & incriminating material from CPI (Maoist) cadre Manoj Kumar in 2018 while he was going to make levy payment to CPI (Maoist) terrorists. Accused sent to 4-day NIA remand.",,,,1285951703049621510,https://twitter.com/ANI/status/1285951703049621510
2020-07-22 09:36:13,ANI,,576,1138,6733,"Delhi: Part of Ashoka Road caved in following heavy rainfall in the national capital region today.pic.twitter.com/WoWgMkSGmA",,,,1285871262271594496,https://twitter.com/ANI/status/1285871262271594496
2020-07-21 18:13:17,ANI,,41,573,4026,"We have watched the Chinese Communist Party (CCP) bully its neighbours, militarize features in the South China Sea, and instigate a deadly confrontation with India: Mike Pompeo, US Secretary of State (file pic)pic.twitter.com/Y5DRdfpzlB",,,,1285638995460919296,https://twitter.com/ANI/status/1285638995460919296
2020-07-20 20:09:46,ANI,,62,825,5794,"Gujarat: Shopkeepers in Ahmedabad claim that demand for Chinese made rakhis has fallen this #RakshaBandhan festival. A shopkeeper says, ""All of us are hurt by China's actions. Customers who come here are willing to pay a little bit more for Indian products instead of Chinese.""pic.twitter.com/9CDKUYpDta",,,#RakshaBandhan,1285305922902822913,https://twitter.com/ANI/status/1285305922902822913
2020-07-20 12:03:20,ANI,,72,288,2038,"I'm saddened but not surprised to be at receiving end of such baseless, vexatious allegations being levelled against me: Sachin Pilot (in file pic) to ANI on Rajasthan Congress MLA Giriraj Singh's allegation that Pilot offered him Rs 35 crores to cross vote in Rajya Sabha pollspic.twitter.com/3pMA1Rqeoe",,,,1285183508122529792,https://twitter.com/ANI/status/1285183508122529792
2020-07-20 09:35:28,ANI,,431,95,887,"Everyone wants that grand Ram Temple is built. But they (the Centre) didn't give place to Shankaracharyas in the Nyas, instead VHP & BJP leaders have been made its members. We object to this: Congress leader Digvijaya Singhpic.twitter.com/2RoLfSOINE",,,,1285146294646800385,https://twitter.com/ANI/status/1285146294646800385
2020-07-20 05:30:10,ANI,,210,937,6808,"#WATCH Karnataka: Asymptomatic #COVID19 positive patients organise a flash mob at a COVID care centre in Bellary where they are admitted. (19.07.2020)pic.twitter.com/30D6E4ESOV",,,#WATCH #COVID19,1285084565879439362,https://twitter.com/ANI/status/1285084565879439362
2020-07-19 15:53:53,ANI,,92,232,2049,"One Indian Army jawan lost his life near the Line of Control in Kargil sector, when he accidentally stepped on an old unexploded explosive device: Indian Army officialspic.twitter.com/aEKzo7RzdK",,,,1284879140273831937,https://twitter.com/ANI/status/1284879140273831937
2020-07-19 08:48:50,ANI,,258,1502,11691,"Kerala: A truck, carrying an aerospace horizontal autoclave for delivery to Vikram Sarabhai Space Centre in Thiruvananthapuram, reached the city today a year after starting from Maharashtra. Staff say, ""Started in July 2019 & travelled across 4 states. Hope to deliver this today""pic.twitter.com/XNaCjXa1C3",,,,1284772172880199680,https://twitter.com/ANI/status/1284772172880199680
2020-07-19 08:25:57,ANI,,34,171,451,"Andhra Pradesh: Huge crowd seen outside a liquor shop in Visakhapatnam, social distancing norms flouted amid #COVID19 pandemic.pic.twitter.com/vmXB3swAUs",,,#COVID19,1284766414050521088,https://twitter.com/ANI/status/1284766414050521088
2020-07-25 08:01:56,ANI,,51,401,2161,"IIT Kharagpur researchers claim to have developed a novel technology for #COVID19 rapid test. Ultra-portable device to cost Rs 400. Customized smartphone application to disseminate test results within 1 hour, without requiring manual interpretation.pic.twitter.com/rkZDvNpXTh",,,#COVID19,1286934695804932096,https://twitter.com/ANI/status/1286934695804932096
2020-07-24 20:28:32,ANI,,7,42,641,"'Tunnel Breaking Ceremony' held yesterday on the completion of caving work for the 1 km long tunnel of Western Dedicated Freight Corridor through Aravalli mountain range, near Sohna in Haryana: Dedicated Freight Corridor Corporation of India Ltd (DFCCIL)pic.twitter.com/ji4poK3OFe",,,,1286760199101980672,https://twitter.com/ANI/status/1286760199101980672
2020-07-24 18:30:30,ANI,,12,105,704,"Samu Oreya, Birsa Oreya and Babita Kacchap involved in Pathalghadi movement in Jharkhand, detained in Gujarat. They were trying to incite people in Vyara and Mahisagar against the government: Gujarat Anti Terrorist Squad (ATS)",,,,1286730493136789510,https://twitter.com/ANI/status/1286730493136789510
2020-07-24 12:36:43,ANI,,58,533,3595,"#WATCH: Two elephants spotted using twigs to comfort themselves at Bannerghatta Biological Park near Bengaluru in Karnataka.pic.twitter.com/JsPbcoNABp",,,#WATCH,1286641462101151745,https://twitter.com/ANI/status/1286641462101151745
2020-07-24 11:19:13,ANI,,36,477,4799,"Shantabai Pawar says, ""By God's grace, I am able to perform at this age and sustain my livelihood. My grandchildren are pursuing their studies and we are happy."" 85-year-old Shantabai Pawar performs 'Lathi Kathi' on streets of Pune to earn a livelihood.pic.twitter.com/BWx9tOaF04",,,,1286621955605450752,https://twitter.com/ANI/status/1286621955605450752
2020-07-23 21:34:34,ANI,ANI,21,413,1708,"If we bend the knee now, our children’s children may be at the mercy of Chinese Communist Party (CCP), whose actions are the primary challenge today in the free world: Mike Pompeo, US Secretary of Statehttps://twitter.com/ANI/status/1286414157542113280 …",,,,1286414426195648513,https://twitter.com/ANI/status/1286414426195648513
2020-07-23 07:43:56,ANI,,87,656,3557,"Bollywood had connections with mafia operating with Pakistan, their funding also used to come from there. It looks like these connections still exist. Friends of many celebs have pictures with Pak Generals & ISI. They should renounce such links: BJP National VP Baijayant Pandapic.twitter.com/zEKfpaMrkZ",,,,1286205390951051264,https://twitter.com/ANI/status/1286205390951051264
2020-07-22 14:03:31,ANI,,12,300,2687,"India has provided pharmaceuticals for over 100 countries around the world. We have had tremendous cooperation with India, and post the visit of the President we've seen several conversations between President Trump and PM Modi: Ken Juster, US Envoy to India at India Ideas Summitpic.twitter.com/3E9s6oFwJh",,,,1285938528170291201,https://twitter.com/ANI/status/1285938528170291201
2020-07-22 04:50:03,ANI,,23,447,4773,"Congratulations to our nuclear scientists for achieving criticality of Kakrapar Atomic Power Plant-3. This indigenously designed 700 MWe KAPP-3 reactor is a shining example of 'Make in India'. And a trailblazer for many such future achievements: Prime Minister Narendra Modipic.twitter.com/kxf1OVjM4k",,,,1285799246294249472,https://twitter.com/ANI/status/1285799246294249472
2020-07-21 12:03:22,ANI,,105,413,3199,"There'll be no lockdown from tomorrow, people need to get back to work, economy is also very important. We have to fight #COVID19 while maintaining stable economy. Lockdown is not the solution, now restrictions will be placed only in containment zones: Karnataka CM BS Yediyurappapic.twitter.com/AI9SBLaA2Q",,,#COVID19,1285545904435367937,https://twitter.com/ANI/status/1285545904435367937
2020-07-21 06:25:05,ANI,,297,141,1418,"Rahul Gandhi is tweeting daily. I think Congress will be reduced to a party that only tweets. One after the other, states are proof that Congress isn't working. A dejected party is attempting to attack Centre in every manner, but they'll not succeed: Union Min Prakash Javadekarpic.twitter.com/nRmrNNcxDC",,,,1285460771795726336,https://twitter.com/ANI/status/1285460771795726336
2020-07-21 05:00:00,ANI,,11,118,1938,"BJP MP Shiv Pratap Shukla has been appointed as the chief whip of the party in Rajya Sabha.",,,,1285439361475964928,https://twitter.com/ANI/status/1285439361475964928
