date,username,to,replies,retweets,favorites,text,geo,mentions,hashtags,id,permalink
2020-07-20 13:42:59,ANI,,56,890,3833,"Results of phase 1/2 Oxford Covid-19 Vaccine trial published. Editor in Chief of UK based medical Journal ‘The Lancet’ says it is “safe, well-tolerated and immunogenic.”pic.twitter.com/8SyI97Dqgb",,,,1285208584863670272,https://twitter.com/ANI/status/1285208584863670272
2020-07-20 09:06:20,ANI,,226,469,3606,"He (Sachin Pilot) was conspiring from past 6 months with BJP's support. Nobody believed me when I used to say that conspiracy is going on to topple govt. Nobody knew that a person with such innocent face will do such thing. I'm not here to sell vegetables, I am CM: Rajasthan CMpic.twitter.com/Kk4TLJZ0v0",,,,1285138962349035520,https://twitter.com/ANI/status/1285138962349035520
2020-07-19 07:20:55,ANI,,153,1003,3694,"#WATCH Delhi: A house collapsed in the slum area of Anna Nagar near ITO today following heavy rainfall. No one was present in the house at the time of the incident. Centralised Accident and Trauma Services (CATS) and fire engines are present at the spot.pic.twitter.com/IwS5X08nps",,,#WATCH,1284750049293955073,https://twitter.com/ANI/status/1284750049293955073
2020-07-19 03:05:56,ANI,,155,500,1824,"#WATCH Delhi: Fire Department personnel rescue people on-board a bus that was stuck in a waterlogged road under Minto Bridge following heavy rainfall in the national capital this morning.pic.twitter.com/wBCjSRtvqw",,,#WATCH,1284685880175685636,https://twitter.com/ANI/status/1284685880175685636
2020-07-18 17:28:44,ANI,,500,399,4101,"Rajasthan: Congress MLAs supporting Chief Minister Ashok Gehlot watch actor Aamir Khan-starrer ‘Lagaan’ at Hotel Fairmont Jaipur.pic.twitter.com/EuySe0dWHj",,,,1284540619860279296,https://twitter.com/ANI/status/1284540619860279296
2020-07-18 07:18:46,ANI,,187,439,3183,"Maharashtra Minister Aaditya Thackeray files a petition before Supreme Court challenging the decision of University Grants Commission (UGC) to conduct final year examinations. Court has not yet admitted the petition for hearing. (file pic)pic.twitter.com/DBv2gI20j2",,,,1284387117557092359,https://twitter.com/ANI/status/1284387117557092359
2020-07-17 13:45:24,ANI,,637,961,5476,"#WATCH Andhra Pradesh: Police destroys liquor bottles worth Rs 72 lakh using a road roller at Police Parade Ground in Machilipatnam of Krishna district.pic.twitter.com/0geaKPKJbK",,,#WATCH,1284122031210946560,https://twitter.com/ANI/status/1284122031210946560
2020-07-17 12:50:19,ANI,,260,1207,4771,"A 40-year-old woman raped at a quarantine centre in Navi Mumbai last night. She is #COVID19 positive. Case registered: Police Officer Ashok Rajput, Panvel Police Station. #Maharashtra",,,#COVID19 #Maharashtra,1284108169019441152,https://twitter.com/ANI/status/1284108169019441152
2020-07-24 16:03:19,ANI,,54,686,3486,"If you & your Home Ministry can't protect Guv then what about law & order in State? What agency should be contacted for Governor's security? I've never heard such statement from any CM. Is this not the beginning of a wrong trend where MLAs protest at Raj Bhawan?: Guv to CM (2/2)",,,,1286693454462857216,https://twitter.com/ANI/status/1286693454462857216
2020-07-24 13:38:32,ANI,ANI,6,27,208,"They reviewed the situation in India-China border areas & ongoing disengagement process along LAC in the Western sector. They agreed that complete disengagement of troops&de-escalation as per bilateral agreement was essential for smooth overall development of bilateral relations.https://twitter.com/ANI/status/1286655449102602240 …",,,,1286657018430799878,https://twitter.com/ANI/status/1286657018430799878
2020-07-24 07:33:54,ANI,,834,512,1831,"#WATCH: ""We are going to the Governor to request him to not come under pressure (and call Assembly session)... varna fir ho sakta hai ki pure pradesh ki janta agar Raj Bhawan ko gherne ke liye aagai, to hamari zimmedari nahi hogi,"" says Rajasthan CM Ashok Gehlot https://twitter.com/ANI/status/1286562853445447681 …pic.twitter.com/ODEq7PZGei",,,#WATCH,1286565254709702656,https://twitter.com/ANI/status/1286565254709702656
2020-07-23 21:37:04,ANI,,5,92,551,"General Secretary Xi Jinping is not destined to tyrannize inside and outside of China forever, unless we allow him: Mike Pompeo, US Secretary of Statepic.twitter.com/XminGEIojl",,,,1286415055420940289,https://twitter.com/ANI/status/1286415055420940289
2020-07-22 10:31:24,ANI,,25,220,1801,"State govt appoints Santoshi, wife of Col Santosh Babu, who lost his life in clashes on India-China Border, as Dy Collector. CM today handed over the appointment letter to her. He has instructed officials concerned to post her in Hyderabad and its surrounding areas: Telangana CMOpic.twitter.com/A7SjDqkGos",,,,1285885147955343360,https://twitter.com/ANI/status/1285885147955343360
2020-07-22 00:33:04,ANI,,11,63,716,"Ravi Shankar Prasad, Union Minister of Information Technology to address the G20 Digital Minister’s meeting today. (file pic)pic.twitter.com/iAOD59x5o6",,,,1285734572618121216,https://twitter.com/ANI/status/1285734572618121216
2020-07-21 20:42:20,ANI,,63,332,2473,"Kerala: 24K gold chains weighing 233.4 grams seized from a female passenger arriving from Muscat by Kozhikode Air Intelligence Unit yesterday.pic.twitter.com/yBJBRjm0Gg",,,,1285676507319414788,https://twitter.com/ANI/status/1285676507319414788
2020-07-21 18:17:53,ANI,,11,178,1262,"Chinese Communist Party’s exploitation of this disaster to further its own interests has been disgraceful. Rather than helping the world, General Secretary Xi Jinping has shown the world the party’s true face: Mike Pompeo, US Secretary of State",,,,1285640154376548353,https://twitter.com/ANI/status/1285640154376548353
2020-07-21 13:37:22,ANI,,214,857,6203,"IPL 2020, that was postponed due to coronavirus, will now be held in the UAE. We have applied for the government's permission. We will discuss the further course of action in IPL General Council: Brijesh Patel, IPL Chairmanpic.twitter.com/aD0OndcQ1Q",,,,1285569561060708353,https://twitter.com/ANI/status/1285569561060708353
2020-07-21 11:22:30,ANI,,26,238,3030,"India's two COVID19 vaccines are in phase 1 and 2 of trials. Discussions have already begun how will the vaccines be made available to all those who need it: Dr VK Paul, Member (Health), NITI Aayogpic.twitter.com/NWUlNf7Ffa",,,,1285535620194942976,https://twitter.com/ANI/status/1285535620194942976
2020-07-21 10:34:38,ANI,,23,73,625,"19 States and Union Territories are performing more than 140 tests per day per million population: Health Ministrypic.twitter.com/6HHDZ54Cd2",,,,1285523572371251203,https://twitter.com/ANI/status/1285523572371251203
2020-07-20 14:21:12,ANI,,142,462,4165,"ICC Men's T20 World Cup 2020 postponed, due to COVID19 pandemic.pic.twitter.com/mFSe1vvZ4t",,,,1285218201492750336,https://twitter.com/ANI/status/1285218201492750336
2020-07-20 10:01:41,ANI,,226,57,983,"Uddhav Thackeray visited Ayodhya after taking oath as the Maharashtra Chief Minister. Shiv Sena has removed the obstacles in the path of construction of Ram Temple. No invitation is needed to visit Ayodhya: Shiv Sena MP Sanjay Rautpic.twitter.com/ur1UrZlPcb",,,,1285152894417657856,https://twitter.com/ANI/status/1285152894417657856
2020-07-20 03:06:41,ANI,,29,266,1688,"Members of Baloch community in the United Kingdom yesterday staged a protest outside 10 Downing Street, against the killings of Baloch women at the hands of Pakistan's paramilitary forces in Balochistan province.pic.twitter.com/a2VY0NDNGG",,,,1285048454058663938,https://twitter.com/ANI/status/1285048454058663938
2020-07-19 11:33:18,ANI,,86,734,4219,"Community transmission has been there from quite some time. It was localised to pockets, for instance- in Dharavi&several areas of Delhi. I 100% agree with IMA that there is community transmission in India: Dr Arvind Kumar, Chairman,Centre for Chest Surgery,Sir Ganga Ram Hospitalpic.twitter.com/dBR1bWkeOR",,,,1284813563035435008,https://twitter.com/ANI/status/1284813563035435008
2020-07-19 07:56:59,ANI,,19,33,246,"MHA jumped into this matter as their political leaders told them they may get trapped as SOG #Rajasthan has evidence&audio clip is authentic. Nation knows CM's honesty. He had said if audio is proven to be false, he'll retire from politics: Pratap Khachariyawas,Rajasthan Ministerpic.twitter.com/CpETjJDyVL",,,#Rajasthan,1284759124157198336,https://twitter.com/ANI/status/1284759124157198336
2020-07-19 05:56:28,ANI,,69,359,1828,"#WATCH Uttarakhand: A leopard entered a house, attacked and killed a dog & took it away last night in Tallital.pic.twitter.com/xX2tf4KYMt",,,#WATCH,1284728792997482497,https://twitter.com/ANI/status/1284728792997482497
2020-07-19 02:19:32,ANI,,141,337,2028,"#WATCH Delhi: A bus got stuck in a waterlogged road under Minto Bridge following heavy rainfall in the national capital this morning.pic.twitter.com/OhwpyIU2Sz",,,#WATCH,1284674203782803456,https://twitter.com/ANI/status/1284674203782803456
2020-07-18 14:48:22,ANI,,153,227,3581,"Karnataka: BJP MP Shobha Karandlaje climbed the steps of Chamundi Hill to visit Shri Chamundeshwari Temple in Mysuru yesterday, despite a ban on visiting temples in view of COVID-19 pandemic.pic.twitter.com/EsTH67L7OO",,,,1284500264162955264,https://twitter.com/ANI/status/1284500264162955264
2020-07-17 23:51:18,ANI,,11,207,1664,"Himachal Pradesh: Tibetans-in exile held protest against China in Dharamshala yesterday. Tenzin Khando, Central Tibetan Women's Association said, ""We want international organizations and communities to stand together against China and hold China accountable.""pic.twitter.com/We1oZSHLzG",,,,1284274510548492288,https://twitter.com/ANI/status/1284274510548492288
2020-07-23 21:21:42,ANI,,6,94,506,"Just this week we announced the closure of China’s consulate in Houston because it was a hub of spying and Intellectual Property theft. 2 weeks ago, we reversed 8 years of cheek turning with respect to international law in the South China Sea: Mike Pompeo, US Secretary of Statepic.twitter.com/0zDCIn8OrU",,,,1286411188939587584,https://twitter.com/ANI/status/1286411188939587584
