date,username,to,replies,retweets,favorites,text,geo,mentions,hashtags,id,permalink
2020-07-12 18:00:36,ANI,,102,597,4557,"Tapan Ghosh, founder of Hindu Samhati passes away. He had tested positive for #COVID19 and was admitted to a hospital in Kolkata.",,,#COVID19,1282374314629623809,https://twitter.com/ANI/status/1282374314629623809
2020-07-12 08:37:53,ANI,,125,209,982,"Bank accounts of Hafiz Saeed and JuD leaders restored after formal approval from United Nations sanctions committee: Pakistan Media (file pic)pic.twitter.com/znhksGq6hk",,,,1282232701336969216,https://twitter.com/ANI/status/1282232701336969216
2020-07-11 23:15:17,ANI,,2,30,289,"Assam: Villages in Mohna ghat area of Dibrugarh have been flooded after water level of Brahmaputra river rose following incessant rainfall; normal life disrupted. (11/7)pic.twitter.com/U0jRwPZ8wW",,,,1282091118969028608,https://twitter.com/ANI/status/1282091118969028608
2020-07-11 14:53:37,ANI,,21,327,2348,"PM has approved a program for 100% electrification of Indian Railways. We'll be the largest railways in world to be 100% electrified with 120,000 track km across India. By 2030, we hope to be world's first 100% green railway with net zero emission: Railways Minister Piyush Goyalpic.twitter.com/4OljEwvE9T",,,,1281964871798550530,https://twitter.com/ANI/status/1281964871798550530
2020-07-11 13:02:16,ANI,,49,338,1095,"West Bengal CM Mamata Banerjee writes to PM Modi on revised guidelines issued by MHRD & UGC with regard to conducting the terminal examinations in colleges & universities, requesting PM to get the matter re-examined immediately and restore earlier advisory of UGC.pic.twitter.com/PeTjNOxa4W",,,,1281936848185520128,https://twitter.com/ANI/status/1281936848185520128
2020-07-11 07:38:01,ANI,,201,767,3414,"Delhi govt has decided to cancel all Delhi state university exams including final exams in view of #COVID19. The degree will be awarded based on evaluation parameters decided by the universities: Delhi Deputy Chief Minister Manish Sisodiapic.twitter.com/wtXs6cK2Ns",,,#COVID19,1281855248030560257,https://twitter.com/ANI/status/1281855248030560257
2020-07-14 14:07:09,ANI,,45,186,3106,"My heartfelt thanks and gratitude to all those who have come out in my support today, tweets Sachin Pilot. He has been removed as Rajasthan Deputy Chief Minister and state Congress president.pic.twitter.com/B3Z5W7hQyu",,,,1283040340992307205,https://twitter.com/ANI/status/1283040340992307205
2020-07-14 09:31:25,ANI,,141,334,2468,"There is nothing in Sachin Pilot's hands, it is the BJP which is running the show. BJP has arranged that resort and they are managing everything. The same team which worked in Madhya Pradesh is at work here: Rajasthan CM Ashok Gehlotpic.twitter.com/owKbOwxKjS",,,,1282970950556766209,https://twitter.com/ANI/status/1282970950556766209
2020-07-14 09:15:22,ANI,,150,618,6249,"Sachin Pilot changes his bio on Twitter (pic 1) after being removed as Rajasthan Deputy Chief Minister and state Congress unit chief (Pic 2: earlier Twitter bio).pic.twitter.com/ro3UWqOdvN",,,,1282966911651688449,https://twitter.com/ANI/status/1282966911651688449
2020-07-14 09:02:30,ANI,,157,104,1858,"Delhi: Congress leader Priyanka Gandhi reaches 10, Janpath to meet party president Sonia Gandhi.pic.twitter.com/tf2EJJCwzb",,,,1282963671707090944,https://twitter.com/ANI/status/1282963671707090944
2020-07-13 12:52:01,ANI,,24,183,2814,"Income Tax raids are underway at the offices of Om Kothari group in Jaipur, Kota, Delhi and Mumbai.",,,,1282659046374273025,https://twitter.com/ANI/status/1282659046374273025
2020-07-13 12:03:57,ANI,,129,577,4095,"Ashok Gehlot govt doesn’t have numbers they claim. CM’s back garden isn't the place to prove majority, it’s done in Assembly. If they have numbers as claimed then why not do a head count, take them to Guv instead of moving them to hotel?: Sources close to Sachin Pilot (file pic)pic.twitter.com/lDoUM8zsOH",,,,1282646946021171200,https://twitter.com/ANI/status/1282646946021171200
2020-07-13 11:42:54,ANI,,2,81,499,"Kerala: National Investigation Agency (NIA) informed the court that the accused smuggled gold twice in 2019, in two batches of 18 kg & 9 kg.",,,,1282641652025135105,https://twitter.com/ANI/status/1282641652025135105
2020-07-13 07:09:39,ANI,,103,267,3071,"Central Board of Secondary Education (CBSE) class 12 exam results announcedpic.twitter.com/ToKynsBLFG",,,,1282572885685501959,https://twitter.com/ANI/status/1282572885685501959
2020-07-13 06:17:35,ANI,,59,338,1695,"Maharashtra: A team of NIA from Delhi is taking Nabeel Siddiique Khatri & Sadia Anwar Sheikh, accused in a case related to activities of ISIK (Islamic State - Khorasan Province), to Delhi today. Both were arrested from Pune's Kondhwa & Yerwada yesterday.pic.twitter.com/CGu3pVVXoX",,,,1282559780708429824,https://twitter.com/ANI/status/1282559780708429824
2020-07-12 07:03:07,ANI,,134,267,4141,"Madhya Pradesh: Special prayers being offered for the good health of Amitabh Bachchan & Abhishek Bachchan at a temple in Ujjain. Actor Amitabh Bachchan & son Abhishek Bachchan tested #COVID19 positive & both admitted to a hospital.pic.twitter.com/sx12Am8InA",,,#COVID19,1282208851706605570,https://twitter.com/ANI/status/1282208851706605570
2020-07-11 23:32:26,ANI,,168,277,3811,"Haryana: Rishita who hails from Narnaund in Hisar, has topped Haryana Board Class 10 exam by scoring 100%. She says, ""My parents & teachers motivated me a lot. I believe hard work is the key to success. I aspire to become a doctor. I don't use social media."" (11/7)pic.twitter.com/Z4JWKkfoZm",,,,1282095433293029376,https://twitter.com/ANI/status/1282095433293029376
2020-07-11 15:15:14,ANI,,170,137,1064,"Madhya Pradesh: A man married his girlfriend & bride chosen by his family in the same mandap in Ghoradongri block of Betul district on June 29. Ghoradongri Tehsildar Monika Vishwakarma said,""Since polygamy is a criminal offence, I'll write to the SHO of police station concerned.""pic.twitter.com/KvWz58fU6w",,,,1281970311571705859,https://twitter.com/ANI/status/1281970311571705859
2020-07-11 11:00:04,ANI,,63,326,1661,"For the sake of our youth, I urge Prime Minister to personally intervene and cancel final year exams of Delhi University and other central govt universities and save the future: Delhi CM Arvind Kejriwalpic.twitter.com/GkZHSmoNaa",,,,1281906096043524097,https://twitter.com/ANI/status/1281906096043524097
2020-07-10 15:37:59,ANI,,33,189,802,"Rashtriya Loktantrik Party (RLP) MP from Rajasthan's Nagaur writes to Prime Minister Narendra Modi, urging him to declare locust attack a national calamity and provide relief to the farmers.pic.twitter.com/4wTT8NGtRC",,,,1281613649405079553,https://twitter.com/ANI/status/1281613649405079553
2020-07-10 11:17:46,ANI,,3,100,535,"NIA registers FIR in #KeralaGoldScandal case under Unlawful Activities (Prevention) Act, 1967, against Sarith, Swapna Prabha Suresh, Fazil Fareed, Sandeep Nair and others in connection with the seizure of 30 kg of gold at Trivandrum International Airport on 05.07.2020.pic.twitter.com/TFb60Q5WEz",,,#KeralaGoldScandal,1281548162864275457,https://twitter.com/ANI/status/1281548162864275457
2020-07-10 09:54:17,ANI,,823,200,1898,"BJP government has turned Uttar Pradesh into 'apradh pradesh'. Criminals like #VikasDubey are prospering & being shielded by people in power. Congress demands a probe by a sitting Supreme Court judge in the entire Kanpur episode: Congress General Secretary Priyanka Gandhi Vadrapic.twitter.com/oci9v5hnBO",,,#VikasDubey,1281527152228237312,https://twitter.com/ANI/status/1281527152228237312
2020-07-10 09:43:11,ANI,,95,2260,19080,"Thank you Indian Air Force, for your partnership. We’re happy to have completed the deliveries of the 22 AH64-E Apache and 15 Chinook helicopters to India: Boeing Indiapic.twitter.com/JENZJRiEp7",,,,1281524361208291328,https://twitter.com/ANI/status/1281524361208291328
2020-07-10 04:49:34,ANI,,106,155,2235,"Law has taken its course. It could be a matter of regret &disappointment for those who raised questions on Vikas Dubey's arrest y'day&death today. MP Police did its job, it arrested&handed him over to UP Police: Madhya Pradesh Home Minister Narottam Mishra on #vikasDubeyEncounterpic.twitter.com/GIiIChND66",,,#vikasDubeyEncounterpic,1281450469085245440,https://twitter.com/ANI/status/1281450469085245440
2020-07-09 19:55:56,ANI,,57,330,2097,"Madhya Pradesh: Mohammad Akhtar, close aide of Atiq Ahmed Ansari, a gangster from Uttar Pradesh, was nabbed by Shahdol Police yesterday. He is being interrogated by Police.pic.twitter.com/kcsDie3Nfk",,,,1281316174681092096,https://twitter.com/ANI/status/1281316174681092096
2020-07-14 06:18:15,ANI,,103,213,1059,"Total 110 samples were collected; of which 24 persons at BJP Office in Patna have tested positive for #COVID19: Sanjay Jaiswal, Bihar BJP President to ANI",,,#COVID19,1282922337218658305,https://twitter.com/ANI/status/1282922337218658305
2020-07-14 06:00:35,ANI,,100,278,1822,"#WATCH: ""The whole crisis (in Rajasthan) is due to Rahul Gandhi and his family because they insult young leaders and are jealous of them... Gandhis only want those do ""he he he"" with them to stay in government,"" says BJP leader Uma Bhartipic.twitter.com/zqFpkkbEOc",,,#WATCH,1282917891998748672,https://twitter.com/ANI/status/1282917891998748672
2020-07-14 02:28:15,ANI,,36,728,8511,"The troops of the Indian Army in extreme conditions improved 100 m of a road for movement of vehicles & cranes to reach out & deal with adverse conditions at Baghjan oil field: Eastern Command, Indian Armypic.twitter.com/gtsE7kKzmL",,,,1282864457899638784,https://twitter.com/ANI/status/1282864457899638784
